{
  "_meta": {
    "projeto_nome": "valenca-odontologia",
    "documento_fonte": "contexto/projetos/Valença Odontologia/Plano de Marketing.docx",
    "hash_documento": null,
    "modelo_llm": null,
    "data_extracao": "2026-05-19T18:00:00-03:00",
    "origem": "gabarito_manual"
  },
  "nome_projeto": "Valença Odontologia — Plano de Marketing 2024",
  "descricao": "Plano estratégico de marketing para clínica odontológica em Valença-BA, com foco em captação de pacientes e fortalecimento de marca local.",
  "local_execucao": "Valença, Bahia",
  "tipo": "consultoria de marketing",
  "porte": "pequeno",
  "objetivos": "- Aumentar 30% o faturamento em 12 meses.\n- Estabelecer presença digital consistente em redes sociais.\n- Posicionar a clínica como referência em odontologia estética na região.",
  "descricao_produtos_servicos": null,
  "licitacao": null,
  "contratos": null,
  "termo_encerramento": null,
  "justificativas_projeto": null,
  "impactos_projeto": null,
  "indicadores_projeto": null,
  "artefatos_produzidos": null,
  "imagens_fotos": null,
  "nome_stakeholders": ["Dra. Maria Valença", "Equipe de marketing — consultoria"],
  "funcao_projeto": ["Cliente / Sponsor", "Consultor responsável"],
  "publico_alvo": null,
  "detalhes_equipe": null,
  "treinamentos_equipes": null,
  "tarefas_projeto": null,
  "requisitos": null,
  "escopo_planejado": null,
  "escopo_executado": null,
  "data_inicio": "2024-03-01",
  "data_fim_planejada": "2025-02-28",
  "data_fim_executada": null,
  "entregas_realizadas": null,
  "status_cronograma": "no_prazo",
  "custo_estimado": 18000.00,
  "custo_realizado": null,
  "justificativas_gastos": null,
  "riscos_identificados": null,
  "analise_qualitativa_riscos": null,
  "analise_quantitativa_riscos": null,
  "planejamento_respostas_riscos": null,
  "monitoramento_riscos": null,
  "custo_implementacao_mudanca": null,
  "analise_custo_beneficio": null,
  "impactos_mudanca": null,
  "pontos_fortes": null,
  "pontos_fracos": null,
  "dificuldades_encontradas": null,
  "providencias_tomadas": null
}
